{
  "$id": "https://example.com/schemas/policy-auto-mode.schema.v1.json",
  "$schema": "https://json-schema.org/draft/2020-12/schema",
  "additionalProperties": false,
  "properties": {
    "version": {
      "enum": [
        "v1"
      ],
      "type": "string"
    },
    "enabled": {
      "type": "boolean"
    },
    "mode": {
      "enum": [
        "selected_only",
        "suggested_only",
        "mixed"
      ],
      "type": "string"
    },
    "limits": {
      "additionalProperties": false,
      "properties": {
        "max_ticks_per_run": {
          "minimum": 0,
          "type": "integer"
        },
        "max_actions_per_tick": {
          "minimum": 0,
          "type": "integer"
        },
        "max_jobs_start_per_tick": {
          "minimum": 0,
          "type": "integer"
        },
        "max_polls_per_tick": {
          "minimum": 0,
          "type": "integer"
        }
      },
      "required": [
        "max_ticks_per_run",
        "max_actions_per_tick",
        "max_jobs_start_per_tick",
        "max_polls_per_tick"
      ],
      "type": "object"
    },
    "dispatch": {
      "additionalProperties": false,
      "properties": {
        "prefer_selected_autopilot": {
          "type": "boolean"
        },
        "prefer_suggested_extension": {
          "type": "boolean"
        },
        "fallback_mapping": {
          "additionalProperties": {
            "type": "string"
          },
          "type": "object"
        }
      },
      "required": [
        "prefer_selected_autopilot",
        "prefer_suggested_extension",
        "fallback_mapping"
      ],
      "type": "object"
    },
    "network_gate": {
      "additionalProperties": false,
      "properties": {
        "default_network_enabled": {
          "type": "boolean"
        },
        "require_extension_policy_enable": {
          "type": "boolean"
        }
      },
      "required": [
        "default_network_enabled",
        "require_extension_policy_enable"
      ],
      "type": "object"
    },
    "board_governance_boundary": {
      "additionalProperties": false,
      "properties": {
        "enabled": {
          "type": "boolean"
        },
        "default_mode": {
          "enum": [
            "report_only",
            "dry_run_only"
          ],
          "type": "string"
        },
        "allow_autonomous_board_apply": {
          "type": "boolean"
        },
        "allow_autonomous_github_mutation": {
          "type": "boolean"
        },
        "require_operator_approval_for_live": {
          "type": "boolean"
        },
        "require_github_ops_live_gate": {
          "type": "boolean"
        },
        "require_network_live_decision": {
          "type": "boolean"
        },
        "allowed_report_only_ops": {
          "items": {
            "type": "string"
          },
          "minItems": 1,
          "type": "array"
        },
        "forbidden_autonomous_actions": {
          "items": {
            "type": "string"
          },
          "minItems": 1,
          "type": "array"
        },
        "required_evidence_fields": {
          "items": {
            "type": "string"
          },
          "minItems": 1,
          "type": "array"
        }
      },
      "required": [
        "enabled",
        "default_mode",
        "allow_autonomous_board_apply",
        "allow_autonomous_github_mutation",
        "require_operator_approval_for_live",
        "require_github_ops_live_gate",
        "require_network_live_decision",
        "allowed_report_only_ops",
        "forbidden_autonomous_actions",
        "required_evidence_fields"
      ],
      "type": "object"
    },
    "notes": {
      "items": {
        "type": "string"
      },
      "type": "array"
    },
    "fail_action": {
      "type": "string",
      "enum": [
        "block",
        "warn",
        "log"
      ],
      "description": "Action to take when this policy check fails. block=hard stop, warn=log+continue, log=record only."
    }
  },
  "required": [
    "version",
    "enabled",
    "mode",
    "limits",
    "dispatch",
    "network_gate",
    "board_governance_boundary"
  ],
  "title": "Policy Auto Mode",
  "type": "object"
}
